The woman gave birth to a child.,The child brought psycho-physical phenomena on a new life.
Otters enter their new habitat.,Otters start looking for abalone for food.
Lila loves classification of her things.,Lila can find what she wants quickly.
She has been vaccined.,The chance she gets flu becomes smaller.
The worker fremented some sugar cane with yeast.,He got some rum.
Grande opened the drawers.,He saw his old clothing.
He wants to travel the Sahara desert.,He will not withstand the dry climate there.
Black pulled out his eyelashes for beauty.,Black's sweat always drips into his eyes.
There are many obstacles on the track.,Racing drivers will encounter common dangers from time to time.
The bar wants to devise some tests.,The bar asks a businessman for help.
Lily has taken some sulfonamedes to make hemolysis.,The medicine didn't work.
No energy is available for the dying plant anymore.,It cannot produce oxygen.
Tom has good eyesight.,Tom found the poisonous snake in time.
Tom wants to know more about production.,Tom set out to go to the dense regions.
The zoologist made an observation of the jaguar's habits.,He observed tracks on the ground where the jaguar had moved its all tour legs.
Lucy has established a community to help those homeless children.,Many of her friends join in the warm-hearted family.
The abuse of nuclear power is terrifying.,Scientists avoid great impact of atoms.
Mr. Howard was going to hiking who had a big bag on his back.,"As he walked, he felt much heavier than before."
He observed the process from germination of seeds to eventually maturation of plants.,He obserevd the growth of the embryo inside the seed at first.
The financial crisis left many people homeless.,"After the financial crisis, the suicide rate increased significantly."
The two competitors became friends of reciprocity.,They often exchange their own privileges.
Mary read some papers.,She knew lots of details.
Sam wished to eat stew for supper.,Sam's wife went to buy some meat.
It's half way through autumn.,It rains more in half autumn than in spring and summer combined.
The major planets interact.,There is gravity among the planets.
Tom has a civet.,The civet eats the fish quickly.
Alice likes the smell of milk.,She always eats cakes with a lot of cream.
Jack wanted to know why Quasars drown out the light from all the other stars in the same galaxy.,He looked it up and found out that it was because they were so bright.
Simon's mother often let Simon eat soys.,Simon grows healthy.
A factory produces several tons of tissues from straws.,The quality of these tissues is different.
Jack added nitrites into the water.,The catfish died earlier than the scalefish in the water.
His action led to the movement of the wheels.,The machine was set in motion.
Jack's interest is to study human species.,He decides to choose anthropology as his major in college.
Father of our religion combined a union of opposite tenets.,His action of syncretism was praised.
Various features show that this is a dicot in the family Piperaceae.,Researchers suspected it is a peperomia.
Tom has measured the magnetism of the material.,It is 15 gammas.
Tom studied the types of polypropylene.,He found that they came in two types.
The source of the mud was investigated.,It was reported that the soil source was very rich.
The student feel anxious to take the exam.,Her teacher gave her a warm smile.
This charity donates money to Asian areas with famine.,Some people western india were helped.
The state began to crack down on competitive economic activities in an all-round way.,The state has launched a policy of collusion.
Tom improved his learning efficiency today.,He finished all his homework ahead of schedule.
Tom wants to eat watermelon.,Tom cut the rind of the watermelon.
Tom give the circuit voltage.,Tom has observed charge movement.
This child caught roseola.,The child had a fever which followed by a rash.
A species gradually adapted to its environment.,This phenomenon is called speciation.
Tom was studying how body temperature rises.,He found out that cytokines worked in it.
Now it's time to remove the drugs from the patient's body.,Various elimination processes was adopted to achieve that.
He successfully solved the problem.,He has a clear understanding of this problem.
The villagers were happy about the harvest.,They had enough food this year.
The lecturer is talking about t lymphocytes.,I can hear t-cells sometimes.
The scientist put some pyridine in the water.,He found the pyridine disappeared.
Amy served as an assistant in this company.,Amy is good at services work.
Virus attacked the mosquitoes.,Human might get infected owing to sick mosquitoes.
Henry always runs into hindrances in doing business.,It is difficult for him to get mind equilibrium now.
The school will hold a ceremony the day after tomorrow.,The school will hold a simulation in advance tomorrow.
Tom has taken use of two pieces of magnets to make his experiment.,He has proved something about the attraction.
The small chicken shoud be incubated under the same temperature.,Tom takes use of a thermostat.
She is allergic to yeast.,She cannot have contact with dough.
The workers have no idea about how to operate the computer.,The leader taught them in person.
The patient with fibroadenomas read his report of mammography.,He was in relief for its benign appearance.
The children will be shipped off to a boarding school.,Their parents taught their children how to solve living problems independently before going to school.
He went to school.,He learned a lot.
The workers are in charge of cleaning debris.,They have to consider the waste.
He asked the cardiologist to watch the condition of the heart.,The doctor said that his heart rhythm is uneven.
Enzymes are necessary for children's growth.,Children are encouraged to eat sprouts.
The house of the people holds justice.,Parliament is a place of justice.
The man devoted himself to journalism.,He mastered the popular language used in pursuit of truth.
Tom found a small dome-shaped beetle.,He said he got a ladybug.
The primates didn't want to be exhibit animals.,They escaped from the zoo.
The root of the plant rotted.,"In order to save the plant, Tom gave it a rhizoid."
Tom was a shepherd.,He took care of a flock of sheep.
Tom feels that his asthma is about to attack.,He eats some singulars.
The teacher gives an example to illustrate the grammar point.,But the students can't understand the example.
Nobody has seen edaphosauruses before.,The scientist observed its appearance.
All relatives entered the family room.,They sat on the chairs one by one.
"There are many people, among which part of them are with normal sight and part of them are blind.",Normal people can see everything and blind people are in a dark world without any light.
The wine must be kept from becoming flabby.,Acidity should be used.
Tom ran into an anemone.,He was poisoned.
The company keeps the steel in a wet warehouse.,The company loses one million due to rust after a few months.
Mary ate lots of chocolate.,She also intook theobromine.
Tracheilds are not suitable to be used as fire materials.,Farmers do not use softwoods as firewoods.
The field was very quiet at night.,The silence was broken by several bird calls.
The possum has eaten an ill bird.,It died.
He served as an accountant in this company.,He worked hard to manage the balance.
Lyle has ophthalmologist.,Lyle's doctor treated him with a laser.
This experiment requires a gray-white solid with a shiny surface.,The teacher provided tellurium.
Their new baby born yesterday.,This new life starts to cry.
The vocal folds vibrated.,Compression sound waves were produced.
Jack's hemoglobin levels are low.,He has been dizzy lately.
Jerry was baptized.,He was identified by the believers.
"Emma, who is a regular coffee drinker, is very hyper these days.",The doctor diagnosed him as caffeinism.
Tom eats some health products containing enzymes every day.,He defecates on time every day.
The angry patient was injected depressants.,He felt calm and relaxed.
The victims were taken to the police office to identify the crimnimal.,They tried to recall the face of the criminal.
Lucy has bought a llot of fresh fruit.,She has made a glass of smoothy.
He just took the pills.,He wants to sleep very much now.
My mother stewed a mahimachi for me at noon.,I've been picking fish bones for a long time.
They are botanists.,They collect specimens everyday.
The old man wants to catch some sunfish.,He caught a bluegill.
This mobile phone is not durable.,The battery often fails to charge.
Tom was finding the fly in his house at night.,He failed.
The baby ground squirrels were hidden by their mom.,They were not found by the rattlesnakes.
Tom committed incest and rape.,He was sentenced to death.
Gongress passed some proposals.,Small buiness benefited from these proposals.
Tom's taste buds on his tongue all lost their function.,Tom couldn't be able to know the taste of whatever he eats.
He mistook lots of thiocyanate.,His thyroid can't uptake iodine normally.
This creature has no anatomies.,Tom decided it isn't a colugo.
He fed meat to the Jackrabbit.,The jackrabbit doesn't eat at all.
Tom perfers beers made with bottom Fermenting yeasts.,He ordered lagers in the bar every time.
The species populations in this area changed abnormally over time.,The process of Succession here was worth exploring.
Tom has put different kinds of materials in the furnace.,Only beryllium has been left.
The ancients recorded by picture writing.,Pictographs were formed step by step.
"My car is exposed to the acid rain,.",The paint on my car is clipped.
Jane wanted to buy a book full of maps bound together.,She bought some atlases.
Mary put the cake into the refrigeratory.,Mary found the cake was rich in moisture the next day.
The doctor treated little Tom's autism with medication.,"After three months of treatment, his autism has improved significantly."
There are many trees with different ages.,They have different textures.
Surface gauss depends on thickness and size of the magnet.,Gauss strength diminishes the further the distance from the magnetic field.
This group of Greys have grown up.,They are large.
The sink has great capacity.,It can hold water up to two liters.
Jack looks at the shape of the rotifers.,He saw their bilateral symmetry.
Tom did examinations to see whether he got cancer.,The doctor's diagnosis confirmed his thought.
Tom believes that dogs and wolves belong to the same phylum.,Tom is wrong.
The light was off at 10 pm.,My pupils became bigger suddenly.
Susan is a midwife.,She was specially trained in childbirth.
He invited his partners to his residence.,They entered his residence.
"In the humid environment, pecan is easier to grow mold on it.",Pecan should be stored in the relatively dry environment.
This biologist has problems in other scientific fields to solve.,Another bilogist helps him.
Leaders of pyramid schemes are extremely good at instilling their own perceptions to members.,"As time goes by, their influence on members grows stronger and stronger."
Tom was looking for Amphibians in winter.,He could only found some sleeping.
The murderer didn't accept himself for a whole life.,He didn't achieve wellness.
My pet tom is in the mating season.,He eats very little.
Tom's family go hiking on the plain.,They find mangroves.
This kind of bear grew in the forest.,This kind of bear habitates in the forest.
Water with minerals flows in the water mains.,On the surface of water mains is some solid stuff.
She was particularly fat.,She had been suffering from diabetes.
It is in the breeding season.,Testicles descend.
The anaconda saw his food in the forest.,He opened his mouth.
The rope connected to my dog was broken.,It ran to other's areas.
Tom was standing in the river and can't move a step.,His legs are entangled in duckweed.
Tom observed the nucleoli of different kinds of chromosomes under the optical microscope.,Tom observed that most of them contain several associated centromeres.
The research set specific aspartate sites.,Caspases cleave target proteins.
We succeed in the end.,Our fate has been changed.
Some plants are infected by a rare kind of virus.,Their cotyledons are destroyed first.
They went to catch eels today.,Many were found after seeing a leaking head in crevices.
Tom's goats were attacked by vampires.,The goats died of blood shortage.
This user spent over 8 hours a day at this site.,This user had a high level of stickiness.
Lucy gave me a pen.,I bought ink for the pen.
We need a person skilled in all aspects of construction.,A carpenter will be recruited.
Tom was born and brought up in Indinana.,Tom is American.
Some enzymes are working on the dead body of a bird.,The body decomposes gradually.
Many goods have been reduced in price recently.,Deflation makes all kinds of shops miserable.
Judy suffered from tics.,She had involuntary movements in her body.
Tom wants to have a bath.,Tom filled the bath tub with hot water.
This monster killed a boy.,This monster was pleased.
Hardwoods are deciduous.,They lose their leaves each fall.
"Knowing that live plants will release oxygen as they grow, a scientist makes experiments to find more information about their process of growth.",The scientist finds that aeration also accurs as they grow.
John only sells amphetamines.,He only looks for people who have failed other weight loss methods.
The author used Personification to descibe the inanimate object.,The reader felt  as though it had human capacities.
They dissected the human ear to see the structure of cochlea.,They found there were  a basilar turn with a cystic cavity.
His mother carried the decay-causing bacteria and kissed him.,He was infected.
Oil is lost quickly during drilling.,Workers use acrylamide.
Several moles were introduced into a piece of farmland where harmful insects thrived.,The insects decreased swiftly in number.
Tom's grandmother is a witch.,Many altars have been set up in his courtyard.
Breast tissue is expected to be activated.,Prolactin is needed.
Tom was interested in studying movement.,Tom majored in kinesiology.
We came to Pygmy land.,They took us in.
Tom wanted some lahars.,He went to a volcano and got some accumulations of unconsolidated materials on the flanks.
Tom sweats a lot.,The doctor said he was suffering from a skin disease.
The seller should avoid nature's way of spoiling things like food.,He found ways to prevent oxidation.
She is the best receptionist in her company.,She is very good at communicating with others.
The man took a photo of the bipe.,His friend saw the two small front limbs on that photo.
He can't see clearly.,There must be something wrong with the nuclei in his brainstem.
Tom has a weak photosensitivity.,He was allergic to the sunshine.
The researcher marked the different allotropes of sulphur.,The researcher found five types of sulphur.
Bill put oil on the firewood.,The whole kitchen was burnt down more quickly.
Lucy has suffered from the gonococcal infection when she was pregnant.,The doctor gave him some medicine containing spectinomycin.
"A woman got infectious in her wound, which led to bacteremia.",The doctor used antipyretic to treat her fever.
Jack put amylase into starch.,The breakdown of starch is accelerated.
Peter likes to go fishing by the lake in spring.,He often catches walleye.
Tom suffered from the demyelination many years ago.,He recently was diagnosed with the multiple sclerosis.
There are different kinds of weather in different places on the earth.,It is much colder along fault lines.
Luke's backbones received outside pressure.,His rigid bones bent.
Gems are precious.,Everyone cherishes the gem as the treasure although there are something else in the mineral kingdom.
Jack is a hairdresser.,His hands were corroded by chemical products.
Tom submitted my ideas as his own.,He was accused of plagarism.
His eyes were lack in light-gathering agents.,He should eat more carrots which is rich in carotenoids.
Tom was a homosexual.,He also had basic needs to make love as others.
Hemingway had a rich life experience.,He produced wonderful literature based on his experience.
The patient suffers from post-polio syndrome.,The patient is plagued by weakness.
Tom is taking a course in cryobiology.,"When he does experiments, he needs to freeze the biological specimens in advance for observation."
This house has some infiltration problem.,Temperature in this house can be very low in winter.
Emily has many beautiful dolls.,Each of them has a fashion hairstyle.
The physics teacher will explain the nature of current in this lesson.,He talked a lot about current loads.
Bob wants to study photosynthesis.,He found many trees with good branches.
The customer considered geomancy  very important.,The house selling girl emphasized the spiritual ecology of the house.
Seals are mammals.,They can live well in winter.
His mother has just gone through menopause.,His mother's bone began to lose rapidly.
This disease caused degenerative changes of the myocardium in Tom's heart.,The bulk of the heart's mass was negatively affected.
The Father gave my baby immersion.,My baby was baptized.
Tom wandered in the early spring.,Tom saw snowdrops.
I am a citizen with all legal rights.,I have enfranchisement regardless of my nationality.
I lack vitamin C.,My mom buys oranges for me.
Parakeets were caught by hunters in their natural environment.,Their nomadic lives were broken.
Mary wants to cook in the kitchen.,Mary find the kitchen in a restaurant.
Lucy works in a courthouse.,She can have a rest after the daytime.
Lucy has reached her sexual maturity.,Her menstruation starts.
Tom saw a typical virago for the first time.,He was shocked.
The percentage of oxygen is low in water.,Iguanas have difficulty in breathing.
The rain forest abounds with rain.,The vegetation there is exceptionally vigorous.
He took opium.,"His wound no longer hurts, and he fainted after being excited."
Tom cut the head of the perch.,He found its jaw.
Weightlifters train very hard.,Their muscles grow fast.
The phonetician said the sound has a high frequency.,He used the picture of its dense pulses to prove his opinion.
The frogs have spawned these days.,The pond is teemed with eggs. .
Sally's throat is severely inflamed.,Sally cannot make any sound.
This part of zone is comfortable for birds to live.,The birds located this zone as habitat.
John was studying the cellular composition of mammals.,He found a lot of taurine.
Mother told Kate how the Osprey carried food.,Kate felt surprised and novel.
The doctor touched the subject's breast.,The subjects' heart rates varied widely.
The country lacks carbohydrates.,They are short of the primary source of fuel.
Harry keeps pairing two flying pigeons.,The little pigeons that he nurtures can fly faster.
Scientists want to study narwhals in the summer.,Scientists arrived in the ice free coastal areas of the Arctic highlands to investigate.
Tom got infected by something unknown.,He was diagnosed with a kind of syndrome.
Alan coated his skin with beeswax.,He tore off the beeswax and successfully depilated.
Tom's father is a chef.,He has a recipe of the dishes that he is good at.
The experimenter expected the Paramecium has a special way of consuming food.,He was surprised at their ways similar to multicellular animals.
The kid hoped to stay away from learning.,She didn't cared about her latency.
The chemist is drawing a tree of the platinum group of metals.,He draws ruthenium as one branch of the tree.
A few microbes live in this lake.,"Several days later, this lake is filled with microbes."
The cattle accidentally ingested nitrate.,The cattle was poisoned.
The wound left during an accident causes great pain for Tom.,He eats some capsaicin and the pain is mitigated.
The chaps ran into problems.,They managed to slove the problems.
The chemistry teacher used some polymers for experiments.,The experiment produced a lot of smoke.
Tom listened to the advice from his teacher.,He learned about his teacher's experience as well.
His father often smokes.,His father was getting weak and suffering from lung cancer.
Tom was hungry when he got up.,His mother cooked some custards and milk for him.
Lymphocytes around the patient's buttom got disease.,The surrounding vessels were influenced.
Linda has suffered from constipation for a week.,She eats some laxatives and her colon expels shit swiftly from the bowel.
A peccarie was attacked by a snake with venom.,This peccarie was unharmed.
I ran out of ammunition for my crossbow.,My friend found more small bolts for me.
Anything containing caustic mixtures of chemicals should not be casually thrown.,Batteries should not be casually thrown.
Tom felt so nervous in the running competition.,His leg cramps.
Tom is under the weather.,The doctor prescribed him an emetic.
It is a freshwater lake.,Various species live in this lake.
Tom is doing his experiment with his classmate.,His classmates were a disservice.
The doctor check the CT of my brain.,He found Abscesses.
The hobo was extremely hungry.,He wants to eat a pie.
Those people had been held in confinement for four years.,Cannibalism developed.
The swimmer saw shark fins in this water.,He chose to leave here.
It rained for the first time in spring recently.,The roadside is full of wild flowers.
All the animals went to participate in the travel competition.,Albatross won the championship.
Jack kept a civet.,He thought it was too noisy.
Mary goes to the optometrist to check her eyes.,The optometrist diagnoses Mary's vision problem.
Jack wanted to know why there were different rates of reaction.,Finally he found out by looking at books that enantiomers can exhibit diffrent chemical properties.
He was of great passion.,His partners were inspired by him.
He keeps many gnus.,The gnus have eaten up the grass on his lawn.
The virus inside the nerve cell can be reactivated.,Some patients worry about recurrences after their recovery.
Tom's heart beat so slowly.,The doctor insert a pacemaker for him.
The country regained the sovereignty.,The country would not be controlled by others any more in a violent way.
The electronegative atom meet the hydrogen H.,H was attached to the former by a covalent bond.
Tom's brain was stimulated a lot.,Tom had an epileptic seizure on the street.
A man who knows pyromancy looks at the burning fire.,He got Tom's fortune for the next week.
Pregnant woman Alice decides to take more folic acid.,She often eats hazelnuts among nuts.
This kind of young animal grow rapidly.,This kind of young animal is likely to suffer from  scurvy.
Mother asks Tom to play the violin in front of relatives.,Tom plucks the strings all the time.
They eat anything like plants.,Algas became their food.
Tom had glibenclamide after drinking.,Tom wanted to throw up.
Atmosphere of the two regions are totally different.,The surfaces of rocky bodies in the two regions are different.
This disaster became a hot topic.,The journalist covered it immediately.
Fiberglass insulation keeps you warm and reduces noise.,This kind of wall attracts many wall makers.
Tom has put a bottle of water in the refrigerator.,He got a bottle of ice.
There is a phenomenon of liver and bile recycling in his body.,The doctor advised him to eat more fiber food.
They got a meadowlark.,They collected its feathers.
Families living throughout temperate Eurasia like eating freshwater fish.,Tench are common food for them.
The cells of milk have some changes.,The milk goes bad.
Jane doesn't want to gain any weight.,She wants to be like birds.
This enzyme facilitated the breakdown of glucose.,It has the function of Glycolysis.
The tips of the chromosome shortens each time the cell divides.,The telomeres shorten as the cell divides.
Tom put a magnet in pins while he was cleaning the table.,Almost all the pins are held together by magnets.
Tom has studied about polypeptides.,He has separated many amino acids.
The minister appointed a representative for him to attend the meeting.,The representatives must be careful with his words since he should be responsible to his minister.
Einstein's father was detected with retinoblastoma.,The doctor told him not to worry. There was basically no pathological change.
Tom looked at how does leadership get the achievement of results.,At last he learned it was through people.
Tom has eaten a lot of grapefruit.,His high blood pressure was cured without the help of drugs.
This river is of high field.,The load divided by its drainage area is large.
Mary was a singer.,She became a background singer in the chorus.
Whiskers are closely connected to the nervous system.,They are sensitive.
Tom rubbed two small pills together into one big pill.,The phenomenon of accretion happened.
Tom's heart is beating abnormally.,The doctor measured his electrocardiogram.
Jane exposed her clothes to the sun.,The colour has faded.
Scientists have discovered a polymer of sugar.,Scientists say it is oligosaccharide.
The beagles were hungry.,They found many food.
The hard-working staff got stocks of his company.,He had securities representing ownership shares of his company.
Audrey and her friends take part in group trips.,At night they set up tents to sleep.
Every human is a life.,Everyone can be susceptible to other people or things.
Usually girls showed better attitude than boys in learning English.,Those girl got higher ability in using English.
Radishes are planted near cole crops.,Many flea beetles have been attracted.
He was a monotheist.,He believes in only one god.
This patient has difficulty in breathing.,He cannot inhale air normally.
