Night was deep.,Cockroaches came out for food.
The Autotrophs in this food chain all dissappeared.,The chain lost some of its producers.
The experimenter made an observation at the lower troposphere.,He discovered the smog.
Sam ate too much and felt bloated in his stomach.,Sam has been burping.
Tom bit his lower lip with his front teeth.,"He made the pronunciation of ""f""."
Put the sloth and the rabbit together.,Sloths still walk the slowest.
Tom usually goes out in the daytime.,He is not likely to see weasels.
Mario described his hometown to his new friends.,His new friends went to his hometown and observed it interestedly.
This horror film tells the story of innocent girls buried alive by ignorant villagers.,Emily suffers from tsunamis because of watching this horror movies.
John explored the altitude variation of swamp.,He found very low topographic relief.
Biologists study everything related to biology.,Biologists never study anything about dysprosium.
This boy loves lees.,The man left the sediment of wine for him.
He kept many waterfowls.,He prepared different foods for them everyday.
Tom is guilty of rape and murder.,He was incarcerated in the state prison.
Defibrillation was applied to resuscitate Tom whose heart nearly stopped.,Tom's heart beat again.
Tom is a Chinese expatriate in Spain.,Tom is not a Chinese citizen.
The veterinarian diagnoses that Jerry's rabbit is sick.,Jerry's rabbit is dead.
Ticks is sensitive to the smell of warm-blooded animals.,Ticks can detect the gas given off by these animals.
The worker was cutting the wood.,He gains a lot of cellulose.
The geography teacher was studying the location of the oceans.,"They found it on a thinner, heavier crust."
Maria is very generous.,She is willing to keep connect with others.
The doctor gave Lucy the same stethoscope she had given to Tom who had a cold.,Lucy has a cold.
Tom is a person filled with occultism.,He always studes about occult.
The pharmacist only had a fake degree.,He was not a trained professional in that field.
Tom is an experienced doctor.,Patients trust Tom.
Alice suffers from claustrophobia.,She fears to taking the elevator.
The experimenter is testing the speed at which electric energy comes down the metal ladder.,The experimenter found that the data conclusion was the same as the speed of light.
Mary saw the colugo open its mouth.,Mary saw its unsual teeth.
John had his joint dislocated.,The joint effusion inside has fast diffusion pathways.
The princess wanted the flowers in all minerals.,Her follower brought her gems.
Societies have legislations.,Societies can preserve these genetic codes generation by generation.
Testers test the toxicity of manganese compounds.,Test showed that permanganates is the highest.
Tom has grown a sunflower in his garden.,He found the sunflwer will change its direction with the change of the sun's direction.
Tom cheated Jane's money by lying.,Jane was heartbroken when finding Tom's lies.
Prevalent phenomena are usually acceptable at that time.,Cannibalism seems to have been acceptable in the earliest times.
I know there will be some lightings tonight.,I close the windows in advance so that the thunders won't scare me.
Tom is an orator.,Tom often has a sore throat.
He has overworked himself.,He fell ill.
There are some mites on the skin of poultry.,The poultry was injured.
Microbats come out at night looking for food.,Tons of insects will be eaten.
Tom has curly hair.,Tom's son has curly hair.
Many people get AIDS every year.,Doctors explain that the incidence rate of AIDS is increasing recently.
Stundents wanted to know which was the least abundant of the naturally occurring rare earth element.,The teacher told them it was thulium.
Tom wants a house where he can dry his clothes.,The seller recommends him an apartment.
The wind is too strong.,Trees are blown down by wind.
The United States is a capitalist country.,The vast majority of officials in its government are men.
I wrote a book of tourism.,People can read a total of my travel experience.
George is cleaning his room.,He sneezes from time to time.
Tom searched the Internet for unique little megapods.,The results showed that the wallaby were the right animal.
The treatment needs Serotonin.,The doctor extracted some from nerve fibers in follicle walls surrounding oocytes.
Tom's family grows buckeyes and chestnut trees.,They have a lot in common.
The worker has found a rowan.,He cut down the trunk.
The curtain factory ran out of materials.,It couldn't produce any curtain.
Tom joined in the team of the Economists.,He began to examine east asian success.
A heavy rain can revive the farm.,The farmed stayed and waited for spring.
Jack ate comfrey by mistake.,He was poisoned.
The teacher observed the mycelium under the microscope.,He found that it had a haploid nuclei.
My mom had a headache.,I treated her with aromatherapy.
Tom likes to drink smoothies.,His mother bought an electric mixer.
Jack wants to eat risotto.,He went to buy rice and meat.
Tom drew a blank American flag.,He added stipes later.
The microbe has a spore-containing structure called capsule.,It made a difference in its life.
Tom often smokes.,The doctor said his lungs were not healthy.
The Myofibrils have different numbers of myofilaments.,They vary in size.
An eight-inch-long creature is attaching to Tom's leg and sucking blood.,It is a leech.
I think specialists in internal medicine are helpful.,I advised my son to be an internist.
An animal ate a yew leaf.,The animal was poisoned.
She suffers from chronic inflammation.,The doctor said that deleterious but variable consequence is fibrosis.
They need to build a furnace.,They brought a boiler firstly.
The doctor told the patient that crying was not a bad thing.,The patient improved with tears.
Tom wanted to know how to use the smartphone.,He looked for manuals of the phone.
This student suffers from nearsightedness.,He has difficulty in seeing distant objects clearly.
This crop field is always very cold due to frost.,The owner of this field build green houses.
A glaucoma patient asked the doctor about the cause.,The doctor said it was because the drainage outlet was blocked and the internal pressure increased.
Flying insects affect people's rest at night in summer.,People are praying for more bats this year.
Tom has been practicing table tennis since he was a boy.,"Later, he became an Olympic champion of table tennis."
The boss tried to calculate the cost of the company this month.,The accountant told the boss that don't forget to take the benefits into account.
Scientists are studying between which cells the sperm is produced.,The results of the study showed that it was the interstitial cells.
Jack want to eat ham.,He opened the refrigerator door.
Scientists detect the acidity and alkalinity of volcanism.,Scientists have detected different pH values from 0 to 12.
Tourist hiked for 3 hours.,All of them sweated a lot.
Mitochondria in the cell were divided into two.,They developed in this way.
The sheep must be a prey in those lions.,The sheep was killed by the lions.
He threw a whole apple into the warm and humid garbage dump.,The apple is rotten.
He asked the cops what they had seen.,"The cops replied, ""Small children.'."
The school assumes the responsibility of taking care of the safety of students on campus.,Teachers forbid the students to run around in the campus.
This material has excellent flexibility.,This material is easy to bent.
The lady wants to live a longer and healthier life.,She becomes a vegetarian.
The government and families strive to guarantee the underlying values of children.,These children's lives are full of happiness.
He has to complete an optical design.,He uses optical instruments.
The child's intestinal gurgling needed some help.,His mom bought him a cup pf yougurt.
He was exposed to some nickel.,Heis skin got a rash.
Scientists put beryllium and iron together.,They stand still.
China's economy were faced with many problems during 1970s.,But we handled them sucessfully and made historical decelopment.
Areoles on stems can prick our skin.,Cactus stems can prick our fingers.
The vet provided my dog with Adjuvants.,The stimulation of the appropriate protective immune response was boosted.
Mr Li wanted to illustrate Enantiomers with examples.,He enumerated a pair of chemical substances.
Tom ate Prednisone.,He has a stomachache.
There was pregnancy on this woman.,Tests revealed that her placenta strongly stimulated progesterone.
The scientist injected the cytotoxin into the cell culture medium.,All cells in the cell culture medium die.
He is the cardinal of this church.,He would lead the chorus at every church service.
Lina inflates the balloon.,The ballon is heavier.
There is grass on alpine steppes.,Yaks were fed on alpine steppes.
The nurse loves taking care of patients.,She often saw their weakness.
Zoologists found a hyena.,After a while there were a lot of hyenas.
Tom spun the manure at high speeds with centrifuges.,The effect of gravity was increased.
Biologists lower the firing threshold of limbic neuron circuits.,Biologists have discovered that dissociation has occurred.
John raised some chinchillas.,He kept the chinchillas locked up at night.
Mary prepared dinners for those boatmen.,She cooked some vegetables.
The kid swallowed a piece of silver by accident.,He got toxic.
It has long-term and heavy rainfalls very often in summer.,This province have frequent flood each summer.
John discovered some chondrites.,He was amazed at the age and history of these stones.
He was watching the eukaryotes that were reproducing.,He found meiosis.
Logan's ligamentum flavum was stretched broken during flexion.,Stemosis intensified during flexion after that.
Jack is good at applying extrapolation in the field of stock and finance.,"By analyzing the economic curve before the stock market disaster in the past, he successfully predicted the financial crisis in 2008."
The company took use of the way of telecommuting.,Lucy doesn't need to go to the company any more.
Tom wanted to know what is the turbulent flow of air through the glottis.,Finally he looked it up and he knew it was because of aspiration.
Tom was guided to draw the dominant creature of agriculture in geography class.,Tom drew some cattle.
Mario can't understand some academic definitions in the online document.,His instructor tells him to find the arrows followed and he will see the explanations.
My aunt found harmful levels of common bacteria in food.,She used Pasteurization to kill them.
He went to wrestling.,He was injured.
The most hazardous chemicals in barns should be kept away from childs.,Childs are not allowed to touch disinfectants.
Tom noticed the brightest radiation of all the thermostats.,He identified the location of hydroxyl.
He observed the early process of food decomposition.,He saw rapid leaching of carbohydrates.
The doctor said he had spondylolisthesis.,The test results showed that his upper vertebra is detached from the lower vertebra.
The body needs six key nutrients to thrive.,Nutritionists suggest balanced food mix.
There is no paper in the printer.,The printer can not work normally.
The United States launched a biological war against Japan.,The United States uses anthrax as its main weapon.
Lucy believed that dinosaurs didn't possess teeth.,Her belief was wrong.
Weeds swallowed this land.,This land was invaded.
The bulbils he raised have been growing for two years.,The bulbils have bloomed.
There has been no rain in the countryside for a month.,The farmer used a hose to draw water out of the well to water the crops.
Deltas are rich in natural fertilizer.,Agriculture develops well in deltas.
The woman had to feed her son with berries.,He vomited and took in some toxins.
The scientist studies water.,He is a hydrologist.
Tom wants to color his soup.,He put into some tomatoes.
Jessy tried to use words to modify a noun and a verb.,She selected an adjective for noun and an adverb for verb.
Amy lives by the side of Neoprene.,She feels coolness in summer and warmth in winter.
He has good cultural adaptability.,He quickly accepted the culture of eating sashimi.
Lucy's father was dignosed with the atherosclerosis many years ago.,Lucy was diagnosed with atherosclerosis.
Hydrogen perxoide tends to be unstable here.,Tom keeps the laborator at room temperature.
This farmer wants to build a fish pond.,The farmer found a suitable area.
The experiment is to realize imitation of Thunder.,It is based on the principle of movement of air.
The progestin implanted in Lucy's body worked.,A state of false pregnancy was established in her body.
We honored a kind of peaceful reconciliation of human difference.,We hold the belief of pacifism.
His body has a poor untake of amino acids.,The doctor recommended that he take a supplement of arginine to help depolarization of gut cells to improve.
I cooked Fucus vesiculosus for my father.,His thyroid function was promoted for more intake of iodine.
Lucy's dog has suffered the brucellosis.,It cannot be a mother any more.
Tom's banjo doesn't work any more.,He changed the string and it works again.
The soap I made contained Myrrh.,The user of the soap tried to obtain such a  fragrant resin from trees.
The medicine prescribed by the doctor before Tom did not work.,The doctor prescribed some more delavirdine for him.
The filter-feeding shellfish ate some algae containing toxins.,Toxins remain concentrated in the shellfish.
The doctor said that we should not undercooked and raw pork.,The purpose is to prevent trichinosis.
Officers need to go through professional training before taking up the post.,"When we come across an emergency, we should call for professional help from officers in time."
There are a lot of various animals in the forest.,The viper is the most poisonous one.
Tom is going to join a party.,Tom is practicing quadrille for dancing with his girlfriend.
He often eats psyllium.,He is still healthy.
This enthic group has survived for thoudsands of years.,Their descendants must be good at adapting to conditions.
Tom swallowed the bulb.,He was poisoned by the active components.
A child sees a piece of cake on the table.,Saliva flows out of his mouth.
The boy curiously followed the flow of the creek.,He found a river finally.
Materials stored in the factory are of high flammability.,Anything causing fire is not allowed here.
Little Emma is four years old.,The doctor confirms that she does not suffer from autism.
She had dependency on drugs.,She ended her days in poverty.
Gorge hates the smell of all onions in the onion family.,He dislikes the Scallions known as green onions as well.
People always like to look at the blue sky and white clouds outside the window.,They always sit in the innermost seat of the plane.
Tom feels his stomach aches.,He was diagnosed with hemias.
Tom bought a lot of specialty from Beijing.,Jack drove a car to pick up Tom and the specialty.
John had HIV virus infection.,His immune system broke down.
Biologists observed the molting of isopods.,He found that they shed half of their exoskeleton each time.
He has been smoking cigarettes for four years.,His finger has been stained with the cigarette.
"Speaking requires the vibration of the vocal cords, which are located in the throat.",Vibrations of the vocal cords cause sore rubbing of the throat.
Faces of all audience watching the horror were projected on the screen.,They saw their own pale faces.
Tom looked at the object representing the pioneers' hardships.,He perceived misery.
The patient's global cerebral functions were affected.,He lost his orientation.
Lucy was doing a research about the material of the underwears.,She found that all of them contain polypropylene.
There are many mosquitoes around Jack's house.,He bought a lot of mosquito repellent.
The baby kept crying when he was hungry.,The mother feeds the baby milk.
A farmer uses a lot of fertilizer to grow his crops.,The crops grow well.
Emotional stress led to his lower body temperature.,He senstively felt the coldness of his extremities.
Tom was infected with anthrax.,He is very ill.
The experimenter is examining the rays in the wood.,The experimenter selected both kinds of wood.
Jackson wanted to study the creatures of the human family.,Jackson's professor recommended him to study hominids.
Grandma and the bank signed a trust agreement.,No one other than grandma can know the contents of the document.
Tom has a healthy heart.,He has a good blood circulation in his body.
Tom's restaurant is not doing well.,He took to the streets to drum up customers.
China is getting better and better.,Chinese will no longer be bullied.
The sound of farting suddenly echoes in the quiet classroom.,The whole classroom burst into laughter.
"In order to make resonance, Tom tries to shake a tub of water with different frequencies.",The water keeps vibrating without his shaking as he tries the same frequency as the water has.
There are many molas in the sea.,Molas are easily bitten by other fish.
This research needs a sessile animal.,The teacher suggested that they choose crinoids.
Tom saw the grass germinate.,"A few days later, Tom observed the taproot of the grass."
Billy is reading about fat.,Billy reads about lipids in his reading.
I compared the faces of a cougar and a cat.,I thought they have similar faces.
Jane is a master of Selvage.,The finished lengthwise edges of her fabric works were always wonderful.
Tom threw a piece of glass onto the quartz. .,The glass broke into pieces. .
The lactating woman took hydrazine.,The baby had related adverse reactions.
Harvests make farmers happy.,Farmers like autumn.
There are many tools in front of the tree.,Tom recognizes the stick at once.
This thruse has hurt its wings.,It has difficulty in flying.
Tom is willing to offer help.,He often assists people.
Hellbenders have strong limbs as sea creatures.,They always walk under the sea.
Gardeners offer the lawn enough fertiles.,The lawn has nitrogen inside.
Tom took a visit to the national park.,Tom saw a lot of pretty birds in the national park.
Tom has exploring the secret of the nature.,He found lectins everywhere.
The two soldiers are very anxious.,There is a great tension between them.
Recording polarity is very important in John's experiment.,John recorded the the phase of the signal in relation to the string vibration.
They were all fleshes.,They had appearances.
John attempted to cheat in the exam.,John's cheating was discovered by the teacher and his exam was terminated.
Foxes have been hunting well recently.,It saves surplus prey.
I appreciated the works of the artist.,I understood the the objectification of his feeling.
The bad guy wants to infere the program.,He found some bullies to make destructions to the building.
The researcher wants to oxidize the ammonia into nitrate.,The researcher made a nitrification.
Everyday there are some germs invading our body.,The immunity system defend our body from being ill.
The students in this class have graduated long time ago.,They all have good jobs now.
The Man hunted Bilbies.,He was caught for killing endangered species of Australian marsupials.
There is a sedge in Tom's garden.,He found the sedge was bending.
The situation in the Middle East is uncertain.,Some experts intend to make some assessments.
Mike lives in a basin.,He is used to the seasonal variability.
Tom likes to open a new book on the first day of a month.,Tom can finish reading at least one book a month.
There is a lot of acidic soil in this place.,Horticulturists plant heaths and eventually make a sea of flowers.
The programmer is detecting the data of object movement.,Programmers detect through flows.
The oosperm of a frog is in the egg.,A tadpole would first feel the world in the pond.
They mixed cement with water by pouring it into the pit.,"After stirring for a while, the contents of the pit synthesize new substances and harden."
Tom has symptoms of keratinization.,The doctor suspects that Tom has squamous cell carcinoma.
Tom used his prizes as evidence.,His potential to win another game was demonstrated.
Harbin Institute of technology uniformly installed the building with heat insulation panels.,Harbin Institute of technology is the best school to keep warm in winter in China.
Many public utilities in this city were very old.,They will be installed with new facilities.
Air enters cavities.,Pouches can let air in.
Insects had contact with his nake wound.,He was infected with virus.
The weather is hot in summer.,Inside the house is cooler than outside.
I was doing experiment on a tundra.,I could barely see trees around.
Conducting electricity without resistance won't emit a lot heat.,The Superconductive material can keep the temperature of the circuit.
The leader's effort had positive effect on the staff.,His encouraging plan had more effectiveness.
The plane needs to fly smoothly.,The plane should not fly in troposphere at last.
He brought his cat to the vet.,The vet asserted it has panleukopenia.
The enemy dropped a lethal biological weapon.,Many people were infected with anthrax.
Peter was particularly good at cryptanalysis at the military academy.,"During the exercise, he successfully cracked the other party's cryptosystem."
He doesn't have a method at all.,His trials always fail.
Yeasts are prokaryotes.,Yeast has no chromosomes.
Scientists need to keep hydrogen peroxide stable.,Scientists keep hydrogen peroxide at room temperature.
They walked along the stream.,They found lots of fish in it.
There is grass on alpine steppes.,Yaks were fed on alpine steppes.
This brand is dominant.,People believe its good quality.
The Humidity was decreased.,The drying time of all paints changed except for latexes.
Patients with cancer always have sudden pain.,The doctor will give them some meperidine.
Ten people in the hospital have schizophrenia.,Nine of them usually have delusions and the other sometimes does.
Tom wants to be refrained from sex.,He became a monk.
I don't want others know I followed Paganism.,I hide the way of my life.
The gametophyte was formed.,Fertilization was ready to start.
He lays on the sofa and watches TV every day.,He soon suffered from obesity.
Atoms in oxygen molecules have a greater ability to attract electrons to themselves than nitrogen molecules.,Oxygen is more electronegative than nitrogen.
Dogs belong to canids.,Dogs only have four legs.
His gum is inflamed.,He had the same symptoms.
The mitochondrion of the leave has been hurt.,The leave is withered.
The manager was greatly irritated by the low salary.,He had strong response toward the salary.
The general killed all villagers there.,All people in the village died.
Tom made a lot of short-term investments with the government.,He made a lot of profits.
A number of artists are invited to the art exhibition.,The art exhibition was a great success.
Toby is very interested in the cliffs of Huashan Mountain.,He goes climbing this summer vacation.
Alice got married last year.,She got pregnant last week.
His penis was pierced by a small wooden stick.,His penis bleeds.
Climates are different in the two places.,The environments in the two places are also different.
Floats are made of lightweight wood.,Balsa is suitable for making a float.
Tom went to the park.,Tom got stinged by mosquitoes.
Mary is a three-year-old baby.,Many of her peers are suffering from tonsillitis.
Tom utilized lyophilization to dispose some lethal virus.,The virus became inactive.
The population of the area is decreasing.,There is profound negative effects.
The female elephant in the zoo is getting old.,It began to grow tusks.
The frail Maria coughs for a long time.,Her lungs are obviously inflamed.
He dug up a snapdragon.,He found it had shallow root.
The researchers conducted cloning experiments.,Some people were responsible for producing genetic copies.
My father only wants individual liberty but not individual responsibility.,What he follows is not real libertarianism.
A cell line is differentiated.,It is different from other cell lines now.
The tumble caused his dehiscence.,The previously joined wound separated.
He bought a big mat.,He used it to cover the floor.
Jerry was in need of a design for his company's logo.,Jerry turned to an enterprises and paid to get a good design.
Some animals hibernate in winter.,Their prey can escape the catastrophe at this time.
I had a margay.,I bought fruit for it.
He wanted some paraffin.,He created a substitution reaction.
The summary of Tom's paper had a mistake.,Professors picked the mistake up immediately.
The altimeter malfunctions and fails to measurie atmospheric pressure.,The plane's altitude cannot be determined.
Steven yearns for the results of the college entrance examination.,"Naturally, Steven is always in a state of anxiety."
"Tom put sweat, tears and saliva on the silk.",Silk has different variations.
Mike became a superman in his dreams.,He thought he can fly even when awake.
A fly was capture by a spider.,The fly was eaten by the spider.
Now we are tourists.,We start our trips.
There is a bee on the periwinkle.,The periwinkle has no reaction.
The amateur observed the shape of moon via images from satellites.,Its shape ranges from highly irregular to sphere.
The villager was terrified of the geysers.,His father told him it was just a manifestation of volcanic activity.
Parents are more traditional than children.,Parents have diffrent styles from children.
Tom mixex some reactants together in a beaker to see what will happen.,The beaker becomes too hot and breaks into pieces.
Too many calories do a lot of harm to human body.,The current trend is to restrict calorie intake.
