He is addicted to alcohol.,He can't control his life.
He earned a lot of mony this season compared with last one.,His profit increased a lot.
The bomb on the left exploded.,The bomb next to it exploded too.
The doctor told William that his eyesight was gradually losing.,The doctor used radiotherapy to treat William.
Courtney feels that she has a high level of carbon dioxide.,The doctor takes a blood test on her.
The ground was scattered with decaying fish.,The air is full of the stink of decayed fish.
Their company has laid down a series of mining rules.,They follow this rule in every mine areas.
The lady hoped her poodle can have enough nutrients.,She bought various food containing proteins and so on.
Tom seached for relevant laws.,He didn't know which version to follow.
Peter exposed a live circuit to a changing magnetic field.,The state of the wire changes.
Tom wanted to do some studies.,Tom went to the school lab and finished the studies.
Explosives dissolve easily in water.,It difficult for scientists to extract the explosive molecules of explosives.
Tom has suffered migraine for a long time.,He felt dizzy yesterday.
They saw meerkats in South Africa.,They were surprised by its unique patterns.
Tom wore two left boots in the morning.,His foot was uncomfortable.
He analysed the composition of the soil.,He discovered many different elements.
Overloading has caused serious consequences.,There are rules for penalizing such consequences.
Mike is a sheriff.,He was elected as officals in his county.
Tom has many adjacent plots.,These plots are full of wheat.
He wiped those nourishment on the tissue.,The test showed that the deeper tissue has got the nourishment.
Larvaceans are growing every day.,Larvaceans would handle more materials to make their houses more comfortable.
Tom borrows money from his colleagues every day.,He is in debt now.
Lucy recently has a diet.,She eats a lot of fruit instead of rice .
This boy was provided with enough toys in his childhood.,His sensory organ developed very well.
Trogons are good at finding cavities.,Trogons built their home in a cavities.
This field is all monoculture.,They all just grow corn.
There are many paths in the park.,They have different functions.
Tom's body is deficient in protein.,The doctor advised him to eat more lean pork.
These membranes are permeable.,Exchanges can occur across them.
Iron man is dying.,Every one in the audience region is weeping or crying.
She had a blood routine examination.,The doctor found the level of carbon dioxide was too high.
John wanted to raise a semi-hardy perennial.,He raised buttercups.
A lady needed twigs to make an art work.,She took the scissors to cut the shrubs.
John is looking in the mirror.,He found his eyes blue.
The house owner wanted some trees inside his house.,He decided to buy some hemlocks.
The house was on fire and the people needed water to put it out.,People came to the bay.
He was confused when he faced options.,He was confused about which career path to choose.
Tom is a petrologist.,Tom studies rocks as his analysis.
I have difficulty checking all the machines.,I turn to the technology of my colleges.
The weather is hot throughout this year.,Beets dosen't grow well.
The doctor diagnosed the spread of virus particles in the patient.,The doctor found that there were on all epithelial surfaces.
The content of methanol in the new house overwhelmed the body's capacity.,The worker was poisoned.
He explored the metal coating of halogen lamps.,He found some dysprosium.
Tony wanted to buy some food.,He bought one hamburger in a McDonald's store.
He grew up and became a well-known jeweler.,He created a lot of fine jewelry.
Those men are hikers.,They have a strong desire to drink water.
Air pressure should be measured.,Barometers are needed.
A group of thiefs were caught.,They handed in the stolen things.
He composted the soil.,The pH of the soil gradually balances out.
My grasshopper did not drink the water I prepared.,"It is normal, what it eats have enough water."
The machine has some functions similar to the human minds.,It can identify some obvious patterns.
Tom squeezed all the fuel with the machine.,The fuel compression was done.
John observes the way animals breathe.,He saw the diaphragm contract as the rabbit inhaled.
I bred this tiny dog as my pet.,My family called it toy.
The frogfish rushed to its prey.,The prey got into its mouth.
Tom stepped in narrow deep cracks in the glacier.,His friend yelled tom stepped in Crevasses.
The list shows that you used much water last month.,I cleaned my whole house in and out during last month.
This special organization is in charge of tracking.,It manages occurrence of data.
Synthetic resin smells toxic when burned.,Tom's clothes made of polyester smell poisonous when burned.
There are many sparrows in the orchard.,Many insects are eaten by them.
He was bit by wasps.,He felt very painful.
My baby became a teenager.,The baby bike could not bear his weight.
I had a budgie.,I found its interest.
Tom is an engineer.,He studies different kinds of structures.
The clocks are moving all the time.,They are like living creatures.
The gardener was hired to take care of my poinsettias.,He prevented it from harm of mealybugs with great efforts.
Tom searched the Internet for the nature of loudness of an instrument.,It turned out to be dynamics.
It is important for people to know important events of the country every day.,The editor has left a special page for national news.
Tom was infected with pneumonia.,Tom's family was worried about him.
Tom has just had a wine.,Tom fails the blood test.
They climbed up to the peak of the hill.,They felt the climate much colder than that at the foot of the hill.
Color in a relatively permanent skin layer like the dermis would not fade soon.,Tattoos can keep its color for a long time.
Kate is suffering from thermal hyperalgesia.,Kate's doctor prescribed a drug containing zinc.
Some of the leaves on Tom's potted plants are getting old and dying.,There are mildew spots on some leaves.
Tom wants to draw a digital image.,Tom draws graphics by drawing pixels.
She is a witch.,She can heal small animals.
Kur is using a microscope to observe the growth of pollen tubes from the surface of pollen grains.,Kur named it germination.
Lucy has suffered form infertility.,Lucy didn't deliver a live baby.
There was a light rain in the polluted city.,The visibility was lower.
The building is of low visibility in fog.,It can only be seen to a low degree.
These adolescent boys haven't had any relationships yet.,Masturbation occurs frequently.
Tom wants to collect fructose.,Tom chooses kiwi to collect fructose.
Tom wants to take photos of kinglets.,Tom goes to evergreen forest to find the bird.
Bob told his mother that the bird was masticating happily.,Mother pointed out Bob's mistake and said that birds can't masticate.
He wants to control noise.,He uses slits as devices.
Peter had a serious illness when he was a baby.,His mental development is slower than that of his peers.
The man invented speech resynthesis.,Its is possible for text-to-speech process in different languages.
The magazine has pictures of naked girls.,The magezing is classified as pornographic magazine.
Ability of chemically interacting with many other substances indicates chemical instability.,Phenols has chemical instability.
The explorer wore crampons in climbing the snow mountain.,The spike-soled boots helped him in climbing.
Mary has to settle all the problems in these three modules.,She tries different principles and solves them respectively.
His major is kinesiology.,He is very knowledgeable about movement.
The multiplet volume increases rapidly.,The occurrence of flocculation had an obvious influence.
He bought some equipment.,He got some cloak devices.
This kingdom is rich in wines.,Their  vines and bounty are envied by other kingdoms.
The restaurant sells Smoothies.,They orders fresh fruit from fruit stores.
Tom has listed a wrong equation.,The whole problem solving process was wrong.
Scientists cut off the lateral roots of ragweed.,Ragweed is still vigorous.
Lake wants to work out full hard glute.,Lake's fitness instructor asked him to practice lunge.
Som oil was added to the carrier oil.,The carrier oil was diluted.
The Adhesives were exposed to oxygen.,They hardened.
Tom lost his legs before many years when he happened to a car accident.,He can't walk.
A boy slipped on the ice.,The boy followed him slipped too.
Tom is going to buy a bicycle.,He is also equipped with a helmet for safety.
This tree has great viability.,It has great potential to germinate.
Tom has some biluminescenes in the sea.,He found that there were some dinoflagellates.
There was a swan in the office.,The official got the beautiful feather.
It had been fifteen years since the aardwolf was born.,It died before long.
There is something wrong with the patient's valve.,The doctor found that his valve did not close when the heart contracted.
Jerry is allergic to lactose.,He may eat most unusual foods by mistake.
A pterosaur was running in the forest.,No one can run more fast than it.
Tom was diagnosed with asexuality.,His wife has no sexual desire on him.
The boys were trained with patterns.,They developed fixed habits.
The orphan Lucy was sad when she saw a happy family.,The leader of the orphanage decided to find a kind person for her to adopt her.
Lucy's trainer is both a teacher and friend.,She extremely likes her trainer.
Tom was lying in the bed and reading a book.,He fell asleep in a few minutes.
Developer Edward was asked to optimize the design.,He hence did unit tests.
Jack suffers from asthma.,Doctors diagnosed his son with asthma.
Tom put a magnet near some coins. .,The coins were attracted together by the magnet. .
Too many activities have been hold in this city.,Some residents were injured during these activities.
The environment here is suitable for the family cercopithicidae.,There are many mangabeys living here.
The acne bacteria was blocked under thick cloth.,The cloth was cut for oxygen to get in.
John put on his the reading glasses to see the ground.,John found a dent in the ground.
"In addition to the daily food, I also put aquatic insects into merganser's nest.",The next day I found that the aquatic insects had been eaten.
A salesman visited her and recommend her some laundry detergents.,She was impressed with the salesman’ politeness.
Some parasites lay their eggs on cloves.,A few days later the eggs died.
Tom picked up a whip.,He gave it back to the jockey.
I heard bird songs from green leaves.,I began to look for the orioles hidden in it.
The workers have prepared some silts.,They plan to utilise them to build walls.
Lucy majors in ecology.,She studies the relations among different creatures.
He put the cells in contact with the surface.,He found that adhesion had occurred.
A robin is hungry.,It flies to the ground for food.
They decided to travel China this summer.,They first left Beijing and started from Shanghai.
He was honored as a hero because of his brave deed.,He was allowed three days of extra holiday and he returned his home.
Tom has a strong ability to survival.,He was the final winner of the game.
Jason and I saw a mammal passing along.,He told me there is a good chance that this mammal is an artiodactyl.
The scientists injected nitrite into child blood.,The scientists found that the oxygen carrying capacity of the child's blood declined.
We saw something plunge-diving from the air.,The teacher explained it was a booby getting its food.
A star crashes into the sun where nucleosynthesis occurs.,The star is burned and squeezed into ashes.
Lucy's mother took use of astragalus to make food for her.,Lucy becomes much healthier than before.
Mineral-rich herb is good to human body.,He bought some chickweed to build his body.
The scientist applied some nitrogen fertilizer to the lawn.,The lawn has absorbed nitrogen fertilizer.
Tom eats dairies every day.,He kept health.
My major is anthropology.,I study people in different culture settings everyday.
Frank eats nutritious food every day.,He is getting smarter and smarter than before.
Mary found the extrusion of a mass through her vagina.,The diagnosis showed that this was prolapse.
He likes making animations.,He enjoys the process of making still images appear alive through the action of motion.
Lucy recenly did a reserach about berkelium.,She found that there was somehting in common with actinide.
There are several ocelots near Tom's farm.,Tom loses his sheep once a week.
Metabolism indicates change of energy.,Trainers have changes of energy in their body.
Grace's father caught a babirusa.,Grace couldn't bite its meat at dinner.
The guest asks for a new plate.,The waitress walked to him.
Lina went into her bedroom carelessly.,She was tripped by the chair.
He said he saw leprechauns yesterday.,I knew he told a lie.
Fresh air should be delivered.,More tubes are needed.
Having pollen stored up is something the bees are keeping for mid-late winter.,The queen begins to increase her egg laying rate at that time.
This bee hurts and cannot dance.,It cannot communicate with other bees about the food sources.
John has a pest infestation in his garden.,He bought some medicine to get rid of squash bugs.
Litter killed the cleaner.,All aspects of society should be responsible for his death.
Jack is an oceanographer.,He is at sea all the year round.
Tim learnt more knowledge with the growth of age.,He becomes more excellent than before.
The man wished to reach Mercury in the atmosphere.,He would have to travel a long distances.
All students have watsed some rice and thrown them.,There are more people starving.
The hunter wants to hunt the deer.,He was always following the deer.
I was starved for days.,I crave for food.
A long shower made my skin lost moisture.,I saw the Shrinkage on my body.
The living environment here is harsh.,The health of residents is affected.
They poured a lot of waste water into the river.,The amount of pollutants they emit exceeds the limit.
Water was used as as a new source of electricity.,This hydro-energetic power manifested its own drawbacks.
Tom has seen a lot of rhes and he bought some food for them.,"They are afraid of being hurt, so they walked and ate the food in Tom's hands."
The students don't know what to represent the weight of a bull.,The teacher said that kilograms should be used.
Tom suffers from diabete.,Tom can only eat food with sweeteners when he wants to eat sugar.
"When it comes to winter, trees begin to shrink.",Cedar shrinks in the smallest sense.
He wanted to remove hard water deposits from glassware.,He used vinegar.
We were curious about the light produced after a chemical reaction.,Our teacher informed us that it was chemiluminescence.
Tom bought some bricks.,He built his own Cuckoo house.
Tom has put a bismuth into the beaker.,He found that the bismuth was oxidized after several hours.
ADIS's doctor says ADIS's brain always unabated thinking.,ADIS's brain is always congested.
The city has a large output of newspapers.,The number of lumber farms around the city has increased.
They were unable to make appropriate decisions.,They asked their team of experts for suggestions.
/p/ can be realized in many ways in actual articulations.,These speech sounds were represented by the phenem /p/.
Tom drink a glass of lemonade.,Tom was full.
John was interested in the study of human images.,He went on to study radiology.
The old woman wants to have food every day.,She tries her best to go to prison.
The illiterary woman has no idea about election.,She wouldn't know the idea of the chosen people.
The man once contacted with contaminated rat urine.,He suffers from leptospirosis now.
The boy was opposed to her idea.,The boy adopted many results to refute her.
The cut was inflamed because of the invading bacteria.,The scientists found lots of leucocytes accumulated in this cut swallowing bacteria.
Resistant starch is difficult to digest.,Then people use the satiety of bananas to lose weight.
Mary likes to eat vegetables without appearance.,Mary doesn't likes to eat parsley.
Mary wants to make the best of her life.,She decides to study economy in college.
The helicopter came to another hemisphere of Earth.,The pilot saw jet streams.
These two are heterosexuals.,They sleep together.
The police fired a shot.,The birds on the tree were scared away.
Tom wants to eat some seafood.,His mother took use of fumigation and made sure that seafood are clean.
Tom loves smiling.,Tom often feels happy.
The philosophers have proposed a lot of true perceptions which are beneficial to poeple's life.,All of generations accepted and took use of them.
The diver visited many ocean basins.,He found beautiful seamounts.
We plan to see ringtails.,We will go to the habitats.
He is a soccer player and good at heading the ball.,He won MVP in the game.
Scientists study the paramagnetism of atoms.,Scientists have discovered the permanent magnetic moment of atoms.
There was an accident.,A journalist was explaining it to the audience.
The temperature has risen.,The pressure in the tank has increased.
I have seen fleas's three stages in their lifecycle.,Fleas have at least three stages.
The flower was beautiful and fragrant.,Lucy went to smell it.
The farmers planted many crops.,Grain can be used to make food.
I've been feeling under stress lately.,Various health problems prevail these days.
This two kids will go to skiing this afternoon.,Their parents asked them to wear protective clothing in case of accidents.
Tom became a father.,He should take on more responsibilities.
Lisa is an architect.,Lisa designs buildings.
The petechiae on his arm became much bigger.,The petechiae might turn into eccchymoses.
Mosquitos are ubiquitous around here.,We can raise some bullfrogs.
Fishermen harvest many fish with broad flat bills and many of them are hurt by the tooth-like notches.,It is the time of trumpeters recently.
The nature is the gift for the whole world.,Faeries like living in it.
He attacked her without proof.,He is quite a lunatic.
Mary bought some boletes from the market this morning.,The boletes decayed this afternoon.
He bought some stock.,He holds securities in a fractional ownership stake in this company now.
Jack is a monotheist.,He believes there is just one god in the world.
Calcium deposits in Tom's arteries.,He is suffering from arteriosclerosis.
Mangabeys took over the forest.,The forest covers a vast area.
Jack lives in the tropics.,Jack's residence produces a lot of sugarcane.
Snowflakes fell down in the humid weather.,People used umbrella to resist sleet.
The hippo and the breeder in the zoo are chasing a ball.,The hippo won.
Tom went to a drama show last night.,Tom went home after the stops.
There is still vegetation near the stream during the dry periods.,The stream keeps flowing.
My companion were tired.,They returned home.
Light can be relax.,Scientists show this is Alpha.
The farmer's wheat got enough nutritions.,The production was of good quality.
Jack put the quilt in the sun to dry.,The quilt is warm.
The witch was not allowed to enter indigenous women's sites.,She had no place to practise rituals.
Lucy took good care of her baby carefully.,Her baby was healthy when she grew up.
The angel controls the Kingdom of Heaven.,Dominion is part of his responsibility.
Tom drew some blood to check his body.,The doctor found that the number of red pigment hemoglobins was too high.
Why do songbirds migrate at night?,It is safer for them.
The canal was lack of water.,The government decided to pump sea water and replace hem in the canal.
He wants to have more muscles.,He took in more zinc.
The master has no lust.,He will not be messed up with love.
The laboratory was asked to study special chromosome traits.,White recommended that the experimenters study the chromosome traits of voles.
The vegetations in our garden was out of control.,We bought herbicides to deal with this problem.
Tom has bought a brightness can.,He can see the path clearly at night.
Mary poured leonardite into a glass of alkali.,The remaining fraction of leonadite is humin.
John became the new leader of the apostolic church.,His goal of evangelism became firmer.
I am responsible for the health management of my child.,I need to plan for his vaccinations.
Scientists found that ptarmigans have different colors in different seasons.,"They observe white ptarmigans in winter, but brown ptarmigans in summer."
John is an orphan.,He has no parents.
The school provides nutritious meals for students.,Students can eat a lot of fruits and vegetables every day.
There is some intercellular matrix of cartilage.,The doctor gave him some medicine containing papain.
He needs to eat foods that are naturally high in nutrition when he is sick.,His mother made lentils for him.
Tom helps Lucy in studying English.,Lucy gained a great success in the English examination.
Tom is looking for some strong materials.,Tom will choose nanotubes over steel.
The little boy digged out a lot of smalite.,The researcher found that it was cobalt.
Tom often eats pineapples.,His mucus is decreasing.
Joy raises a bluebird in her yard.,She needs to provide dead bugs everyday.
Test revealed a something growing on his brain coverings.,The doctor said it was meningiomas.
Lila was sitting under an apple tree.,Lila was beaned by an apple falling from the tree.
John compared Iridium with platinum.,H e found both are white but Iridium has a slight yellowish cast.
Tom has been heavily crashed down by a car.,He can't control his passage of stool.
He is worried about his fibroadenomas will become malignant.,The doctor says it is impossible to become malignant.
The seller had grown these breeds for a long time.,He would sell the mature breeds.
Scientists observe hemispheres.,Scientists have observed the jet streams.
Something is wrong with my camera flash.,I cannot take new Photos now.
"In ancient times, ministers would write to the emperor and put forward their precious opinions for solving national issues.",The emperor can solve problems for the people thoroughly.
It looks like rain outside.,Tom brings an umbrella.
Humanity have gradually appeared on the earth.,The earth's environment is getting worse every day.
They are the first settlers on this island.,They found a lot food.
White tails are very striking.,Cottontails are always caught by eagles.
Mumps virus is rampant in kindergartens.,Jennifer unluckily develops mumps.
The machine has some functions similar to the human minds.,It can identify some obvious patterns.
He bled heavily during the operation.,He is in urgent need of a blood transfusion.
Lily likes to eat small red fruit.,Dad planted some trees for her.
Humans are vertebrates.,They have a spine.
Tom was filled with heavy pressure because of the exam.,He had a serious headache.
Tom killed a cow and got 300 kgs of beef and 100 kgs of fat from the carcass.,The cow's yield is three versus one.
It has been fifteen years since the wine is bottled.,The bottle aging of the wine is fifteen years.
John took in some thiocyanate.,John's thyroid couldn't take in iodinein salt as usual.
The guards are responsible of preventing wildfire for the forest.,They are extremely cautious only during drought periods.
Only this country has appropriate climate for this plant.,This plant is only distributed here.
There are some vascular plants growing here.,There are more bryophytes distributed here.
"Mary has two pieces of farmland, but only one of them is used to grow crops every year.",The often used farmland produces a lot more crops than the less often used one.
He's incontinent.,He can't control his stool.
The experimenters wanted to turn oxygen into an electron recipient.,The experimenter intends to adjust the ionic bond.
Long-chaine polymer molecules are elastic and attrition resistant.,Rubber is elastic and attrition resistant.
Plant tomatoes in a cold place.,Tomatoes grow slowly.
James had smallpox.,James died from explosion of millions of cells.
I come to the Australian coastal water to have fun.,I find some seaweed.
She sealed these grapes in the bottle.,These grapes got fermentation.
Dogs have sharp teeth.,They open their jaws when they encounter tough bones.
He grows many canes.,They grow new leaves in spring.
Bob argued to the judge that he had no intention of killing though he put a knife around the victims's neck.,The judge held that he had committed a crime for his action and sentenced him.
The infant was provided with a nipple.,He suckled it via intuition.
Tom bought clothes in the same shop again.,The clthes are in different styles.
Mike's father was doing rehabilitation.,It shows that Mike's father achieved the maximum functional potential after the process.
Black ink in Jack's pen went out.,He can't write with this pen.
Tom's rabbits have hairballs in their stomaches.,Tom's rabbits are dead.
Merchants built cabins in the mountains to facilitate trade.,These cabins are now historic buildings.
I am a good dancer.,I have rotational inertia.
Vaccines activiated antobodies in Tom's body.,Vaccines brought circulating defense agent against the disease for his immune system.
The students was majoring in optics.,He studies a lt about  the dispersion of light.
Tom swallowed a large amount of laxative by mistake.,Tom has a persistent abdominal pain.
Tom is very envious of the job as jailers.,They only need to guard prisoners every day.
Mary was diagnosed with lymphopenia yesterday.,Her immune system has weakened since last month.
Mario feels thirsty.,He is looking for bowls.
